{"agentProcessCount":6,"benchmarkImplementationSha256":"4709b9193fd892f50269b786fb855680389e0445a74d391c93c18ac92097a7c9","budget":{"contractMaximumCostUSD":5.843528,"currency":"USD","estimatedMaximumCostUSD":0.12,"hardStudyCapUSD":0.12,"liveProxyCapPerCellUSD":0.03,"minimumWalletReserveUSD":80.0},"candidate":{"id":"margin-0.3.2-machine-readable-manual-v16","manifestDigest":"cf8aea9d0314e8e758f4776d5a507c0e09e974bbbdd2b3434130030d35f1e3fd","manifestSha256":"886312d3b4ec1d497115638713aca3eeed34db1d79ab5a83fdb8a0194470a245","manualSha256":"777d994771d144762bf3153472eabffcae47a25906ca0e8024c693fcc2142f18","marginSha256":"eff8723a4cbb101b86dc91f48b486e29d10d68e353cb72566ab546e1cdf10597","settingsSha256":"0bc16a9f67b43757a18af2c65137baa5776f071425f68af2de843f14a7d6f26c"},"crossoverPlanSha256":"9ff2addf2b0721ee038c475c9ec484965a19e28c0d1ed5372ca165f1cf249e32","developmentCases":true,"failurePolicy":{"automaticPaidRetry":false,"completedCellReplay":"verify-and-skip","continueAfterUnsafeOrIncompleteCell":false,"orphanedAttempt":"stop-for-operator-review"},"generationKeyID":"sha256:20f1f3737a3acd36856ab5956f1f03c1e7754bc62f3e2f4c628d988ede12dd49","id":"sha256:66757d68f427cf173346fb302c16e3ee7760787675746cf60ec5adfe461f65eb","jobCount":4,"jobs":[{"agentProcessCount":1,"candidateID":"margin-0.3.2-machine-readable-manual-v16","contractMaximumCostUSD":1.460882,"controlProfile":"single-agent-margin-v1","episodeID":"parallel_shards:0:1fe63b51c305","fingerprint":"1fe63b51c305211c00fbb9e4ab1bc1bde29f8d998ffdf1c4a2ddd1cb26e33297","id":"sha256:f2ca3c6a186275df7344112596ec1849fbffa3e544cbf62ce6dbb0c562943f57","liveProxyCapUSD":0.03,"ordinal":1,"phasePolicy":"serial-stable-role-order","repetition":0,"roles":["author","reviewer"],"scenario":"parallel_shards","schema":"urn:marginbench:crossover-prime-job:v1","traceSeats":["agent"]},{"agentProcessCount":2,"candidateID":"margin-0.3.2-machine-readable-manual-v16","contractMaximumCostUSD":1.460882,"controlProfile":"role-separated-margin-only-v1","episodeID":"parallel_shards:0:1fe63b51c305","fingerprint":"1fe63b51c305211c00fbb9e4ab1bc1bde29f8d998ffdf1c4a2ddd1cb26e33297","id":"sha256:52ed031f6c23e314ad54c997643e51817b4adea5b89ac40aa2037924d68ffefd","liveProxyCapUSD":0.03,"ordinal":2,"phasePolicy":"scenario-defined","repetition":0,"roles":["author","reviewer"],"scenario":"parallel_shards","schema":"urn:marginbench:crossover-prime-job:v1","traceSeats":["author","reviewer"]},{"agentProcessCount":2,"candidateID":"margin-0.3.2-machine-readable-manual-v16","contractMaximumCostUSD":1.460882,"controlProfile":"role-separated-margin-only-v1","episodeID":"specialist_audit:0:0585d0a6ef74","fingerprint":"0585d0a6ef74e198ccc093b3b6b53fb6826ddab85dbc5d138e48c2454b08b2cc","id":"sha256:a4727a45241d7b8a59ff0d5e9e75950ed10a3e3fcb672a42648b9b406b522084","liveProxyCapUSD":0.03,"ordinal":3,"phasePolicy":"scenario-defined","repetition":0,"roles":["author","reviewer"],"scenario":"specialist_audit","schema":"urn:marginbench:crossover-prime-job:v1","traceSeats":["author","reviewer"]},{"agentProcessCount":1,"candidateID":"margin-0.3.2-machine-readable-manual-v16","contractMaximumCostUSD":1.460882,"controlProfile":"single-agent-margin-v1","episodeID":"specialist_audit:0:0585d0a6ef74","fingerprint":"0585d0a6ef74e198ccc093b3b6b53fb6826ddab85dbc5d138e48c2454b08b2cc","id":"sha256:7fdbf384c5f2f5159840dc0d032ec14c99547db399e583aa1259fa00c1ba8747","liveProxyCapUSD":0.03,"ordinal":4,"phasePolicy":"serial-stable-role-order","repetition":0,"roles":["author","reviewer"],"scenario":"specialist_audit","schema":"urn:marginbench:crossover-prime-job:v1","traceSeats":["agent"]}],"limits":{"inputTokenCeilingPerCall":1000000,"inputTokenCeilingSource":"https://help.aliyun.com/zh/model-studio/text-generation-model/","liveProxyMaxRequestBytes":1048576,"liveProxyTemplateTokenAllowance":8192,"maxConcurrent":1,"maxInputTokens":40000,"maxOutputTokens":6000,"maxTokensPerCall":1800,"maxTotalTokens":16000,"maxTurns":8,"providerResponseTokenAllowance":8,"rolloutTimeoutSeconds":180.0,"temperature":0.0,"upstreamAttemptsPerTurn":3,"wallTimeoutSeconds":300.0},"model":"qwen/qwen3.7-flash","pricing":{"billingOverheadUSDPerCall":0.0002,"inputPricePerMillion":0.03,"outputPricePerMillion":0.13,"source":"https://help.aliyun.com/zh/model-studio/text-generation-model/"},"schema":"urn:marginbench:crossover-prime-plan:v1","taskSet":"public-development-v1","track":"team"}