{"agentProcessCount":3,"benchmarkImplementationSha256":"4709b9193fd892f50269b786fb855680389e0445a74d391c93c18ac92097a7c9","budget":{"contractMaximumCostUSD":2.921764,"currency":"USD","estimatedMaximumCostUSD":0.06,"hardStudyCapUSD":0.06,"liveProxyCapPerCellUSD":0.03,"minimumWalletReserveUSD":80.0},"candidate":{"id":"margin-0.3.2-structured-manual-v17","manifestDigest":"c5cf06195acf1ef033e3b17b0c4a39cf71d1224e337039e948726dfeb493f0fa","manifestSha256":"99fb5cfd3d659b412e66b4d34215120b3c324a07a8e411114ad0c72201c38dfb","manualSha256":"5b7a8988983fd648ab475074952cde34820068ab643b8cc68693adb8dac47c1f","marginSha256":"63896b7b5afda0691a8c7855e50f9b989cd7b519eb15e51713cf1096175f7964","settingsSha256":"8def2e04b50429caa790f81df7e86ecd377965d84ce5d358740764cdefa20ee8"},"crossoverPlanSha256":"a826a054bbdbfe9d887063c4cb985c33153a411a0aebaaa47166f5c3a78c2cbc","developmentCases":true,"failurePolicy":{"automaticPaidRetry":false,"completedCellReplay":"verify-and-skip","continueAfterUnsafeOrIncompleteCell":false,"orphanedAttempt":"stop-for-operator-review"},"generationKeyID":"sha256:20f1f3737a3acd36856ab5956f1f03c1e7754bc62f3e2f4c628d988ede12dd49","id":"sha256:4849b1b2bd918931e969f1557666567065f45b0d4e1e93c61b71bd67a9cca19b","jobCount":2,"jobs":[{"agentProcessCount":2,"candidateID":"margin-0.3.2-structured-manual-v17","contractMaximumCostUSD":1.460882,"controlProfile":"role-separated-margin-only-v1","episodeID":"parallel_shards:0:1fe63b51c305","fingerprint":"1fe63b51c305211c00fbb9e4ab1bc1bde29f8d998ffdf1c4a2ddd1cb26e33297","id":"sha256:5cdfb0a164f5cb5cd6cf559e0d98b596d283700badbf5ac213400e372d4c33da","liveProxyCapUSD":0.03,"ordinal":1,"phasePolicy":"scenario-defined","repetition":0,"roles":["author","reviewer"],"scenario":"parallel_shards","schema":"urn:marginbench:crossover-prime-job:v1","traceSeats":["author","reviewer"]},{"agentProcessCount":1,"candidateID":"margin-0.3.2-structured-manual-v17","contractMaximumCostUSD":1.460882,"controlProfile":"single-agent-margin-v1","episodeID":"parallel_shards:0:1fe63b51c305","fingerprint":"1fe63b51c305211c00fbb9e4ab1bc1bde29f8d998ffdf1c4a2ddd1cb26e33297","id":"sha256:422c21b18209c7edc7b42fb9570e52677424e6f5a3090ab78beb3eeeb9cb8e8e","liveProxyCapUSD":0.03,"ordinal":2,"phasePolicy":"serial-stable-role-order","repetition":0,"roles":["author","reviewer"],"scenario":"parallel_shards","schema":"urn:marginbench:crossover-prime-job:v1","traceSeats":["agent"]}],"limits":{"inputTokenCeilingPerCall":1000000,"inputTokenCeilingSource":"https://help.aliyun.com/zh/model-studio/text-generation-model/","liveProxyMaxRequestBytes":1048576,"liveProxyTemplateTokenAllowance":8192,"maxConcurrent":1,"maxInputTokens":40000,"maxOutputTokens":6000,"maxTokensPerCall":1800,"maxTotalTokens":16000,"maxTurns":8,"providerResponseTokenAllowance":8,"rolloutTimeoutSeconds":180.0,"temperature":0.0,"upstreamAttemptsPerTurn":3,"wallTimeoutSeconds":300.0},"model":"qwen/qwen3.7-flash","pricing":{"billingOverheadUSDPerCall":0.0002,"inputPricePerMillion":0.03,"outputPricePerMillion":0.13,"source":"https://help.aliyun.com/zh/model-studio/text-generation-model/"},"schema":"urn:marginbench:crossover-prime-plan:v1","taskSet":"public-development-v1","track":"team"}